{
  "$schema": "https://json-schema.org/draft/2020-12/schema",
  "$id": "https://example.com/spider/artifacts.schema.json",
  "title": "Spider Artifact Registry (artifacts.json)",
  "type": "object",
  "additionalProperties": false,
  "required": ["version", "systems", "weavers"],
  "examples": [
    {
      "version": "1.0",
      "project_root": "..",
      "weavers": {
        "spider-sdlc": {
          "format": "Spider",
          "path": "weavers/sdlc"
        }
      },
      "systems": [
        {
          "name": "MyApp",
          "weaver": "spider-sdlc",
          "artifacts": [
            { "name": "Product Requirements", "path": "architecture/PRD.md", "kind": "PRD", "traceability": "DOCS-ONLY" },
            { "name": "Overall Design", "path": "architecture/DESIGN.md", "kind": "DESIGN", "traceability": "FULL" },
            { "name": "Initial Architecture", "path": "architecture/ADR/0001-initial-architecture.md", "kind": "ADR", "traceability": "DOCS-ONLY" },
            { "name": "Features Manifest", "path": "architecture/features/FEATURES.md", "kind": "FEATURES", "traceability": "DOCS-ONLY" }
          ],
          "codebase": [
            { "name": "Source Code", "path": "src", "extensions": [".ts", ".tsx"] }
          ],
          "children": [
            {
              "name": "Auth",
              "weaver": "spider-sdlc",
              "artifacts": [
                { "path": "modules/auth/architecture/PRD.md", "kind": "PRD", "traceability": "DOCS-ONLY" },
                { "path": "modules/auth/architecture/features/feature-sso/DESIGN.md", "kind": "FEATURE", "traceability": "FULL" }
              ],
              "children": []
            }
          ]
        }
      ]
    }
  ],
  "properties": {
    "version": {
      "type": "string",
      "minLength": 1,
      "description": "Schema version"
    },
    "project_root": {
      "type": "string",
      "minLength": 1,
      "default": "..",
      "description": "Relative path from artifacts.json to the project root directory. All paths in artifacts and codebase are resolved relative to this."
    },
    "weavers": {
      "$ref": "#/$defs/weavers"
    },
    "systems": {
      "type": "array",
      "description": "Root-level systems (top of the hierarchy tree)",
      "items": {
        "$ref": "#/$defs/system_node"
      }
    }
  },
  "$defs": {
    "weavers": {
      "type": "object",
      "description": "Registry of weaver packages. Each weaver defines a template directory and format.",
      "additionalProperties": {
        "$ref": "#/$defs/weaver"
      }
    },
    "weaver": {
      "type": "object",
      "additionalProperties": false,
      "required": ["format", "path"],
      "properties": {
        "format": {
          "type": "string",
          "minLength": 1,
          "description": "Template format identifier. Use 'Spider' for full Spider tooling support with validation. Other values are treated as custom formats with LLM-only semantic processing."
        },
        "path": {
          "type": "string",
          "minLength": 1,
          "description": "Path to weaver package directory (resolved relative to project root). Contains artifacts/{KIND}/ and codebase/ subdirectories."
        }
      }
    },
    "system_node": {
      "type": "object",
      "additionalProperties": false,
      "required": ["name", "weaver"],
      "properties": {
        "name": {
          "type": "string",
          "minLength": 1,
          "description": "System/subsystem/component name"
        },
        "weaver": {
          "type": "string",
          "minLength": 1,
          "description": "Reference to a weaver ID from weavers"
        },
        "artifacts": {
          "type": "array",
          "description": "Artifacts belonging to this system node",
          "items": {
            "$ref": "#/$defs/artifact"
          }
        },
        "codebase": {
          "type": "array",
          "description": "Source code directories belonging to this system node",
          "items": {
            "$ref": "#/$defs/codebase_entry"
          }
        },
        "children": {
          "type": "array",
          "description": "Nested child systems (subsystems, components, modules, etc.)",
          "items": {
            "$ref": "#/$defs/system_node"
          }
        }
      }
    },
    "artifact": {
      "type": "object",
      "additionalProperties": false,
      "required": ["path", "kind"],
      "properties": {
        "name": {
          "type": "string",
          "minLength": 1,
          "description": "Human-readable name for the artifact (optional, for display purposes)"
        },
        "path": {
          "type": "string",
          "minLength": 1,
          "description": "Path to the artifact file (resolved relative to project root). Must be a file path, not a directory."
        },
        "kind": {
          "type": "string",
          "minLength": 1,
          "description": "Artifact kind (e.g., PRD, DESIGN, ADR, FEATURES, FEATURE). Template resolved at: {weaver.path}/artifacts/{KIND}/template.md"
        },
        "traceability": {
          "type": "string",
          "enum": ["FULL", "DOCS-ONLY"],
          "default": "FULL",
          "description": "FULL = traceability to codebase (default); DOCS-ONLY = documentation-only tracing"
        }
      }
    },
    "codebase_entry": {
      "type": "object",
      "additionalProperties": false,
      "required": ["path", "extensions"],
      "properties": {
        "name": {
          "type": "string",
          "minLength": 1,
          "description": "Human-readable name for the codebase entry (optional, for display purposes)"
        },
        "path": {
          "type": "string",
          "minLength": 1,
          "description": "Path to source code directory (resolved relative to project root)"
        },
        "extensions": {
          "type": "array",
          "minItems": 1,
          "items": {
            "type": "string",
            "pattern": "^\\.[A-Za-z0-9]+$"
          },
          "description": "File extensions to include (e.g., .rs, .ts, .py)"
        },
        "singleLineComments": {
          "type": "array",
          "items": {
            "type": "string",
            "minLength": 1
          },
          "description": "Single-line comment prefixes (e.g., [\"#\", \"//\"]). If omitted, defaults based on file extension."
        },
        "multiLineComments": {
          "type": "array",
          "items": {
            "$ref": "#/$defs/multiline_comment"
          },
          "description": "Multi-line comment delimiters. If omitted, defaults based on file extension."
        }
      }
    },
    "multiline_comment": {
      "type": "object",
      "additionalProperties": false,
      "required": ["start", "end"],
      "properties": {
        "start": {
          "type": "string",
          "minLength": 1,
          "description": "Opening delimiter (e.g., /*, <!--, \"\"\")"
        },
        "end": {
          "type": "string",
          "minLength": 1,
          "description": "Closing delimiter (e.g., */, -->, \"\"\")"
        }
      }
    }
  }
}
